{
  "id": "intro",
  "title": "Level: Welcome Text",
  "next_level": "coordinate_systems",
  "elements": [
    {
      "type": "video",
      "url": "https://youtu.be/pDEb45Get2E?list=PLNpMof0wu8uQRZSwUCvoo6cxjm7mqUKkM"
    },
    {
      "type": "text",
      "markdownFile": "description.md"
    },
    {
      "type": "button",
      "text": "Start",
      "url": "https://scratch.mit.edu/projects/editor"
    }
  ]
}
